GCA_005406085.2,Prionailurus bengalensis euptilurus (Amur leopard cat),Prionailurus bengalensis,100,2020/09/15 00:00,Kyoto City Zoo,20431,214455,SAMD00153258
GCF_000313985.2,Echinops telfairi (small Madagascar hedgehog),Echinops telfairi,78,2019/07/15 00:00,Broad Institute,20425,54422506,SAMN00216137
GCA_001262655.1,Eulemur macaco (black lemur),Eulemur macaco,21,2015/08/06 00:00,University of Chicago,20038,405987,SAMN03699689
GCF_000754665.1,Bison bison bison (American bison),Bison bison,60,2014/10/08 00:00,University of Maryland,19971,7192658,SAMN02947321
GCF_000260255.1,Octodon degus (degu),Octodon degus,80,2012/05/01 00:00,Broad Institute,19847,12091372,SAMN00769067
GCA_902168325.1,Peromyscus nudipes (rodents),Peromyscus nudipes,50,2019/08/20 00:00,UNIVERSITY OF NEW HAMPSHIRE,19831,38248,SAMEA5777200
GCF_000296735.1,Chrysochloris asiatica (Cape golden mole),Chrysochloris asiatica,66,2012/09/19 00:00,Broad Institute,19632,13470186,SAMN00744889
GCA_003945745.1,Oryx gazella (gemsbok),Oryx gazella,61.9,2018/12/14 00:00,University of California Davis,19498,1579191,SAMN09604855
GCA_902168405.1,Peromyscus aztecus (Aztec mouse),Peromyscus aztecus,50,2019/08/22 00:00,UNIVERSITY OF NEW HAMPSHIRE,19239,34920,SAMEA5777989
GCA_015147995.1,Dugong dugon (dugong),Dugong dugon,64,2020/08/31 00:00,"Environmental Genomics Office, Center for Environmental Biology and Ecosystem Studies, National Institute for Environmental Studies",19047,31096,SAMD00237432
GCA_004025085.1,Thryonomys swinderianus (Greater cane rat),Thryonomys swinderianus,58.2,2019/01/15 00:00,Broad Institute,18955,21523,SAMN07678129
GCA_004025105.1,Tamandua tetradactyla (southern tamandua),Tamandua tetradactyla,30,2019/01/15 00:00,Broad Institute,18654,19789,SAMN07678112
GCA_004027815.1,Nycticebus coucang (slow loris),Nycticebus coucang,32.3,2019/01/16 00:00,Broad Institute,17693,19724,SAMN07678100
GCA_004363475.1,Perognathus longimembris pacificus (Pacific pocket mouse),Perognathus longimembris,59.6,2019/03/22 00:00,Broad Institute,17686,24714,SAMN07678105
GCF_000298275.1,Orycteropus afer afer (aardvark),Orycteropus afer,44,2012/09/20 00:00,Broad Institute,17683,7875832,SAMN00744890
GCA_008750995.1,Microcebus griseorufus (primates),Microcebus griseorufus,40,2019/09/30 00:00,Duke University,16653,16816,SAMN10707780
GCA_009793145.1,Cynopterus brachyotis (lesser short-nosed fruit bat),Cynopterus brachyotis,108,2019/12/23 00:00,National University of Singapore,16627,251278,SAMN10857275
GCA_007922815.1,Macrotus californicus (California big-eared bat),Macrotus californicus,47.7,2019/08/08 00:00,Broad Institute,16404,16948,SAMN07678130
GCA_004023925.1,Felis nigripes (black-footed cat),Felis nigripes,17.1,2019/01/15 00:00,Broad Institute,16007,18631,SAMN07678084
GCA_902168415.1,Peromyscus melanophrys (plateau mouse),Peromyscus melanophrys,50,2019/08/20 00:00,UNIVERSITY OF NEW HAMPSHIRE,15784,32296,SAMEA5777993
GCF_000280705.1,Jaculus jaculus (lesser Egyptian jerboa),Jaculus jaculus,78,2012/07/30 00:00,Broad Institute,15675,22080993,SAMN00728442
GCA_008750955.1,Microcebus mittermeieri (Mittermeier's mouse lemur),Microcebus mittermeieri,35,2019/09/30 00:00,Duke University,15314,15314,SAMN10707781
GCF_000327345.1,Myotis davidii (bats),Myotis davidii,110,2012/12/20 00:00,BGI,15182,3454484,SAMN01103204
GCA_004026855.1,Lepus americanus (snowshoe hare),Lepus americanus,32.6,2019/01/16 00:00,Broad Institute,15057,16725,SAMN07678042
GCA_007922795.1,Nycticeius humeralis (evening bat),Nycticeius humeralis,41.7,2019/08/08 00:00,Broad Institute,14267,15095,SAMN07678030
GCA_006408655.1,Tragulus kanchil (even-toed ungulates),Tragulus kanchil,187,2019/06/24 00:00,Northwestern Polytechnical University,13850,243497,SAMN08714472
GCA_007922775.1,Antrozous pallidus (pallid bat),Antrozous pallidus,35.7,2019/08/08 00:00,Broad Institute,13442,13958,SAMN07678034
GCA_006410775.1,Tragelaphus imberbis (lesser kudu),Tragelaphus imberbis,117,2019/06/24 00:00,Northwestern Polytechnical University,12858,1775046,SAMN08714498
GCA_000465285.1,Eidolon helvum (straw-colored fruit bat),Eidolon helvum,18,2013/09/13 00:00,"School of Biological & Chemical Sciences, Queen Mary University of London",12668,27684,SAMN02212690
GCA_004329385.1,Megaptera novaeangliae (humpback whale),Megaptera novaeangliae,102,2019/03/06 00:00,Arizona Cancer Evolution Center (ACE),12321,9138802,SAMN10585801
GCA_015708975.1,Procyon lotor (raccoon),Procyon lotor,34,2020/12/01 00:00,Smithsonian Herndon Data Center,12040,1449398,SAMN08536241
GCA_001685075.1,Ellobius lutescens (Transcaucasian mole vole),Ellobius lutescens,130,2016/07/14 00:00,Erasmus medical center (ErasmusMC),11648,242123,SAMN04317027
GCA_005458795.1,Marmota vancouverensis (Vancouver marmot),Marmota vancouverensis,25,2019/05/16 00:00,Canada's Genomic Enterprise,11502,1590947,SAMN09425912
GCA_006410695.1,Philantomba maxwellii (Maxwell's duiker),Philantomba maxwellii,195,2019/06/24 00:00,Northwestern Polytechnical University,11377,383899,SAMN08714509
GCA_006410515.1,Procapra przewalskii (Przewalski's gazelle),Procapra przewalskii,209,2019/06/24 00:00,Northwestern Polytechnical University,10405,5522907,SAMN08714485
GCA_004027735.1,Carollia perspicillata (Seba's short-tailed bat),Carollia perspicillata,27.7,2019/01/16 00:00,Broad Institute,10341,10739,SAMN07678055
GCA_002189225.1,Eschrichtius robustus (grey whale),Eschrichtius robustus,11,2017/06/09 00:00,Purdue University,10066,187455,SAMN06837692
GCA_004027615.1,Cercopithecus neglectus (De Brazza's monkey),Cercopithecus neglectus,27.5,2019/01/16 00:00,Broad Institute,9789,10270,SAMN07678070
GCA_006408735.1,Sylvicapra grimmia (bush duiker),Sylvicapra grimmia,236,2019/06/24 00:00,Northwestern Polytechnical University,9720,583330,SAMN08714508
GCA_001675575.1,Neotoma lepida (desert woodrat),Neotoma lepida,48,2016/06/23 00:00,University of Utah,9584,151693,SAMN04893622
GCA_000465405.1,Pteronotus parnellii (Parnell's mustached bat),Pteronotus parnellii,17,2013/09/13 00:00,"School of Biological & Chemical Sciences, Queen Mary University of London",9502,22675,SAMN02212709
GCA_006411015.1,Tragelaphus spekii (Sitatunga),Tragelaphus spekii,176,2019/06/24 00:00,Northwestern Polytechnical University,9477,46427,SAMN08714499
GCA_004025125.1,Tolypeutes matacus (placentals),Tolypeutes matacus,22.1,2019/01/15 00:00,Broad Institute,9441,10217,SAMN07678115
GCA_000978805.1,Balaenoptera bonaerensis (Antarctic minke whale),Balaenoptera bonaerensis,60,2015/03/18 00:00,"Division of Biological Science, Graduate School of Science, Kyoto University",8410,20082,SAMD00016608
GCA_006408485.1,Muntiacus crinifrons (black muntjac),Muntiacus crinifrons,116,2019/06/24 00:00,Northwestern Polytechnical University,8265,1305444,SAMN08714476
GCA_001685095.1,Ellobius talpinus (Northern mole vole),Ellobius talpinus,50,2016/07/14 00:00,Erasmus medical center (ErasmusMC),8259,15246,SAMN04317029
GCA_006408635.1,Nanger granti (Grant's gazelle),Nanger granti,141,2019/06/24 00:00,Northwestern Polytechnical University,7454,528456,SAMN08714487
GCA_004024985.1,Saiga tatarica (even-toed ungulates),Saiga tatarica,18.8,2019/01/15 00:00,Broad Institute,6406,6453,SAMN07678151
GCA_013634535.1,Diceros bicornis minor (black rhinoceros),Diceros bicornis,40,2020/07/24 00:00,University of Venda,6035,28520426,SAMN14912225
GCA_011754075.1,Pontoporia blainvillei (franciscana),Pontoporia blainvillei,18,2020/03/25 00:00,Universidade do Vale do Itajai (UNIVALI),5888,6929,SAMN02649573
GCA_004027635.1,Crocidura indochinensis (insectivores),Crocidura indochinensis,32.2,2019/01/16 00:00,Broad Institute,4927,4929,SAMN07678044
GCA_008795845.1,Balaenoptera physalus (Fin whale),Balaenoptera physalus,40,2019/10/01 00:00,Korea Ocean Research & Development Institute,4493,871016,SAMN02192672
GCA_002564305.1,Octomys mimax (viscacha rat),Octomys mimax,10,2017/10/17 00:00,McMaster University,4478,4874,SAMN06642006
GCA_002564285.1,Tympanoctomys barrerae (plains viscacha rat),Tympanoctomys barrerae,10,2017/10/17 00:00,McMaster University,4179,4698,SAMN06642005
GCA_000751575.1,Capreolus capreolus (Western roe deer),Capreolus capreolus,24,2014/09/09 00:00,UNIMELB,4167,10458,SAMEA2531521
GCA_004027915.1,Capromys pilorides (Desmarest's hutia),Capromys pilorides,26.1,2019/01/16 00:00,Broad Institute,4080,4081,SAMN07678066
GCA_002335545.1,Apodemus speciosus (large Japanese field mouse),Apodemus speciosus,65,2017/09/12 00:00,University of the Ryukyus,4003,49031,SAMD00084465
GCA_004365215.1,Cuniculus paca (Lowland paca),Cuniculus paca,23.4,2019/03/22 00:00,Broad Institute,3890,3892,SAMN07678075
GCA_006461725.1,Moschus chrysogaster (alpine musk deer),Moschus chrysogaster,310,2019/06/25 00:00,Northwestern Polytechnical University,3769,100428,SAMN08714478
GCA_900006375.2,Gulo gulo (wolverine),Gulo gulo,75,2018/12/06 00:00,Uppsala University,3657,178272,SAMEA3522159
GCA_004364475.1,Ziphius cavirostris (Cuvier's beaked whale),Ziphius cavirostris,30.6,2019/03/22 00:00,Broad Institute,3606,3608,SAMN07678128
GCA_000181375.1,Tupaia belangeri (northern tree shrew),Tupaia belangeri,0,2006/06/08 00:00,Broad Institute,2974,2974,SAMN03004381
GCA_004365275.1,Tupaia tana (large tree shrew),Tupaia tana,25,2019/03/22 00:00,Broad Institute,2971,2973,SAMN07678117
GCA_003071005.2,Phocoena phocoena (harbor porpoise),Phocoena phocoena,87.2,2020/11/10 00:00,University of Potsdam,2838,28296388,SAMN08000480
GCA_000004035.1,Macropus eugenii (tammar wallaby),Notamacropus eugenii,2,2009/11/06 00:00,Tammar Wallaby Genome Sequencing Consortium,2602,36602,
GCA_001707965.1,Phodopus sungorus (rodents),Phodopus sungorus,37,2016/08/18 00:00,University of Chicago,2392,2392,SAMN05191964
GCA_006410755.1,Tragelaphus eurycerus (bongo),Tragelaphus eurycerus,112,2019/06/24 00:00,Northwestern Polytechnical University,1974,12574,SAMN08714502
GCA_004027775.1,Bradypus variegatus (Brown-throated sloth),Bradypus variegatus,57.9,2019/01/16 00:00,Broad Institute,1900,1900,SAMN07678054
GCA_004027955.1,Chaetophractus vellerosus (Screaming hairy armadillo),Chaetophractus vellerosus,22.9,2019/01/16 00:00,Broad Institute,1606,1606,SAMN07678071
GCA_013391785.1,Hydrodamalis gigas (Steller's sea cow),Hydrodamalis gigas,11,2020/07/08 00:00,National Research Center Kurchatov Institute,1345,1430,SAMN15314634
GCA_006411685.1,Tragelaphus buxtoni (mountain nyala),Tragelaphus buxtoni,112,2019/06/24 00:00,Northwestern Polytechnical University,1286,7367,SAMN08714501
GCA_006416875.1,Tragelaphus oryx (eland),Tragelaphus oryx,97,2019/06/24 00:00,Northwestern Polytechnical University,1262,1262,SAMN08714500
GCA_006417275.1,Ourebia ourebi (oribi),Ourebia ourebi,113,2019/06/24 00:00,Northwestern Polytechnical University,1259,1259,SAMN08714494
GCA_001305905.1,Apodemus sylvaticus (European woodmouse),Apodemus sylvaticus,17,2015/10/02 00:00,University of Liverpool,1208,245982,SAMN03863808
GCA_000688575.1,Cavia aperea (Brazilian guinea pig),Cavia aperea,333,2014/01/21 00:00,Leibniz Institute for Zoo and Wildlife research,1039,27928671,SAMN02252454
GCA_006408545.1,Alcelaphus buselaphus (hartebeest),Alcelaphus buselaphus,161,2019/06/24 00:00,Northwestern Polytechnical University,889,12034,SAMN08714483
GCA_007922845.1,Canis lupus (gray wolf),Canis lupus,28,2019/08/08 00:00,The University of Melbourne,842,64175042,SAMN03366711
GCA_007646695.1,Thylacinus cynocephalus (Tasmanian wolf),Thylacinus cynocephalus,42.8,2019/07/30 00:00,The University of Melbourne,461,1923833,SAMN06049672
GCA_009493645.1,Bos grunniens x Bos taurus (dzo),Bos grunniens x Bos taurus,60,2019/11/04 00:00,University of Nebraska - Lincoln,72336424,104384344,SAMN12153487
GCA_009914755.1,Homo sapiens (human),Homo sapiens,50,2020/01/22 00:00,T2T Consortium,71707030,90050182,SAMN03255769
GCA_006511355.1,Sus scrofa scrofa (pig),Sus scrofa,20.61,2019/07/03 00:00,University of Messina,52150866,138999934,SAMN08035066
GCA_015443085.1,Capra hircus (goat),Capra hircus,117,2020/11/13 00:00,Northwest A&F University,46208332,102383509,SAMN14408556
GCA_003254725.2,Canis lupus dingo (dingo),Canis lupus,60,2020/09/11 00:00,James Cook University,40716615,64250934,SAMN09397198
GCA_013276365.1,Canis lupus familiaris (dog),Canis lupus,112.2,2020/06/04 00:00,University of New South Wales,37759230,64291023,SAMN14380863
GCA_003369685.2,Bos indicus x Bos taurus (hybrid cattle),Bos indicus x Bos taurus,136,2018/11/30 00:00,University of Adelaide,37061043,102763607,SAMN08473802
GCA_011064465.1,Homo sapiens (human),Homo sapiens,123,2020/03/04 00:00,Johns Hopkins University,34306965,145105607,SAMN03283347
GCA_002180035.3,Homo sapiens (human),Homo sapiens,80,2018/05/22 00:00,The Genome Institute at Washington University School of Medicine,29396877,89384495,SAMN04229552
GCA_015227675.1,Rattus norvegicus (Norway rat),Rattus norvegicus,92,2020/11/04 00:00,Wellcome Sanger Institute,29198295,135012528,SAMN16261960
GCA_001524155.4,Homo sapiens (human),Homo sapiens,73,2017/07/19 00:00,The Genome Institute at Washington University School of Medicine,29140631,89467683,SAMN03838746
GCA_003634875.1,Homo sapiens (human),Homo sapiens,75,2018/10/19 00:00,Pacific Biosciences,26292878,152514555,SAMN10182268
GCA_016077325.1,Equus asinus (ass),Equus asinus,211,2020/12/11 00:00,"Dairy Cattle Research Center, Shandong Academy of Agricultural Sciences",25075547,98598843,SAMN08939908
GCA_014905855.1,Homo sapiens (human),Homo sapiens,1167,2020/09/26 00:00,Tohoku University Advanced Research Institute for Innovations in Next-Generation Medicine,23601496,141953703,SAMD00243993
GCA_011100615.1,Macaca fascicularis (crab-eating macaque),Macaca fascicularis,53.648,2020/03/10 00:00,Baylor College of Medicine Human Genome Sequencing Center,21344639,150377965,SAMN14146612
GCA_008641055.3,Canis lupus familiaris (dog),Canis lupus,30,2020/04/14 00:00,James Cook University,20914347,64346267,SAMN12574852
GCA_002077035.3,Homo sapiens (human),Homo sapiens,75,2018/02/09 00:00,The Genome Institute at Washington University School of Medicine,16821028,89003101,SAMN05181962
GCA_011100685.1,Canis lupus familiaris (dog),Canis lupus,100,2020/03/10 00:00,Uppsala University,14840767,64299765,SAMN13230619
GCA_011100535.1,Callithrix jacchus (white-tufted-ear marmoset),Callithrix jacchus,63.44,2020/03/10 00:00,Vertebrate Genomes Project,14650776,136971485,SAMN12368443
GCA_011100555.1,Callithrix jacchus (white-tufted-ear marmoset),Callithrix jacchus,63.44,2020/03/10 00:00,Vertebrate Genomes Project,13255626,136971485,SAMN12368443
GCA_014441545.1,Canis lupus familiaris (dog),Canis lupus,56.5,2020/09/02 00:00,The Roslin Institute,12024593,64037277,SAMN14478636
GCA_900006655.3,Gorilla gorilla gorilla (western lowland gorilla),Gorilla gorilla,75,2016/12/22 00:00,UNIVERSITY OF WASHINGTON,9406846,20634945,SAMEA3541598
GCA_011170295.1,Ovis aries (sheep),Ovis aries,175,2020/03/11 00:00,Northwest A&F University,8699377,103700880,SAMN13678651
GCA_011078405.1,Callithrix jacchus (white-tufted-ear marmoset),Callithrix jacchus,63.44,2020/03/10 00:00,Vertebrate Genomes Project,8609028,146897247,SAMN12368443
GCA_008058575.1,Macaca mulatta (Rhesus monkey),Macaca mulatta,100,2019/08/22 00:00,"Kunming Institute of Zoology, Chinese Academy of Sciences",8187455,148403059,SAMN10721089
GCA_002844635.1,Sus scrofa (pig),Sus scrofa,65,2017/12/20 00:00,USDA ARS,6372407,131458098,SAMN07325927
GCA_015476435.1,Homo sapiens (human),Homo sapiens,100,2020/11/15 00:00,Frasergen Bioinformatics Inc,5215207,141840420,SAMN14638796
GCA_005444595.1,Canis lupus familiaris (dog),Canis lupus,50,2019/05/30 00:00,University of Michigan,4722218,64204256,SAMN04851098
GCA_015776825.1,Sus scrofa (pig),Sus scrofa,110,2020/12/07 00:00,China Agricultural University,4265198,137575542,SAMN15501053
GCA_004886185.2,Canis lupus familiaris (dog),Canis lupus,45,2019/08/16 00:00,University of Missouri,3131423,61087166,SAMN10749847
GCF_003668045.3,Cricetulus griseus (Chinese hamster),Cricetulus griseus,31,2020/06/11 00:00,CHO Genome Community,2711962,274391693,SAMN07140313
GCA_013371645.1,Oryctolagus cuniculus cuniculus (rabbit),Oryctolagus cuniculus,40,2020/06/22 00:00,Uppsala University,1879078,140390130,SAMN15208106
GCA_007644095.1,Sus scrofa (pig),Sus scrofa,361,2019/08/01 00:00,Novogene,1009524,140438739,SAMN09531794
GCF_000001515.7,Pan troglodytes (chimpanzee),Pan troglodytes,0,2016/05/03 00:00,Chimpanzee Sequencing and Analysis Consortium,384816,26972556,SAMN02981217
GCA_001292825.2,Homo sapiens (human),Homo sapiens,165,2015/11/12 00:00,Baylor College of Medicine,373039,74315606,SAMN00009513
GCF_000003205.7,Bos taurus (cattle),Bos taurus,19,2015/11/19 00:00,Cattle Genome Sequencing International Consortium,276285,6806220,SAMN02898106
GCF_000298735.2,Ovis aries (sheep),Ovis aries,166,2015/11/20 00:00,International Sheep Genome Consortium,150472,100009711,SAMN00116405
GCF_000264685.3,Papio anubis (olive baboon),Papio anubis,104,2017/04/20 00:00,Human Genome Sequencing Center,149817,585721,SAMN02981400
GCF_000306695.2,Homo sapiens (human),Homo sapiens,38,2013/06/14 00:00,Washington University School of Medicine,143936,50362920,SAMN02205338
GCF_000002305.2,Equus caballus (horse),Equus caballus,0,2007/10/29 00:00,The Genome Assembly Team,112381,46749900,SAMN02953672
GCF_000002125.1,Homo sapiens (human),Homo sapiens,0,2007/09/24 00:00,J. Craig Venter Institute,108431,17664250,SAMN02981236
GCF_000772875.2,Macaca mulatta (Rhesus monkey),Macaca mulatta,47.4,2015/11/30 00:00,Baylor College of Medicine Genome Sequencing Center,107172,4193270,
GCA_000212995.1,Homo sapiens (human),Homo sapiens,0,2008/09/24 00:00,J. Craig Venter Institute,100385,18941691,SAMN02981236
GCA_000252825.1,Homo sapiens (human),Homo sapiens,0,2008/09/24 00:00,J. Craig Venter Institute,100373,18942049,SAMN02981236
GCA_000365445.1,Homo sapiens (human),Homo sapiens,0,2004/02/25 00:00,Celera Genomics,97525,2954094,SAMN02981219
GCF_000003055.6,Bos taurus (cattle),Bos taurus,9,2014/11/25 00:00,"Center for Bioinformatics and Computational Biology, University of Maryland",96955,6380747,SAMN02898106
GCF_000409795.2,Chlorocebus sabaeus (green monkey),Chlorocebus sabaeus,95,2014/03/25 00:00,Vervet Genomics Consortium,90449,81825804,SAMN01760484
GCA_000317765.2,Capra hircus (goat),Capra hircus,175,2015/09/16 00:00,Beijing Genomics Institute,73533,9094169,SAMN02953816
GCF_000258655.2,Pan paniscus (pygmy chimpanzee),Pan paniscus,26,2015/08/18 00:00,Max-Planck Institute for Evolutionary Anthropology,66676,8197324,SAMEA1029457
GCA_002933975.1,Bos indicus (zebu cattle),Bos indicus,100,2018/02/22 00:00,Anand Agricultural University,64498,104295553,SAMN08225763
GCF_000151905.2,Gorilla gorilla gorilla (western lowland gorilla),Gorilla gorilla,80,2014/12/19 00:00,Wellcome Trust Sanger Institute,52934,81227029,SAMEA2272491
GCA_001712695.1,Homo sapiens (human),Homo sapiens,154.7,2016/09/20 00:00,Genome Research Foundation,47865,25272253,SAMN04018081
GCF_000002265.2,Rattus norvegicus (Norway rat),Rattus norvegicus,0,2006/12/06 00:00,Celera Genomics,39779,27430032,SAMN03000701
GCF_000146795.2,Nomascus leucogenys (northern white-cheeked gibbon),Nomascus leucogenys,5.6,2012/12/08 00:00,Gibbon Genome Sequencing Consortium,35148,52956880,SAMN02981257
GCA_011800105.1,Rattus rattus (black rat),Rattus rattus,117,2020/04/01 00:00,Max Planck Institute for the Science of Human History,31539,145848398,SAMN14087596
GCA_003704035.3,Peromyscus maniculatus bairdii (prairie deer mouse),Peromyscus maniculatus,115,2020/09/17 00:00,Harvard University / Howard Hughes Medical Institute,30111,115033041,SAMN10150431
GCF_000004665.1,Callithrix jacchus (white-tufted-ear marmoset),Callithrix jacchus,6.6,2010/01/22 00:00,Washington University (WashU),29273,5167444,SAMN02981242
GCF_000002255.3,Macaca mulatta (Rhesus monkey),Macaca mulatta,0,2006/02/27 00:00,Macaca mulatta Genome Sequencing Consortium,25707,6094595,SAMN02981228
GCA_015598185.1,Tachyglossus aculeatus (Australian echidna),Tachyglossus aculeatus,76,2020/11/19 00:00,BGI,25012,38566698,SAMN12991080
GCA_000002115.2,Homo sapiens (human),Homo sapiens,0,2004/02/25 00:00,Celera Genomics,23350,29133171,SAMN02981219
GCA_001624295.1,Mus musculus (house mouse),Mus musculus,60,2016/04/26 00:00,Wellcome Trust Sanger Institute,23042,132982296,SAMN04489815
GCA_001624215.1,Mus musculus (house mouse),Mus musculus,60,2016/04/26 00:00,Wellcome Trust Sanger Institute,19043,129072804,SAMN04489813
GCA_001624745.1,Mus musculus (house mouse),Mus musculus,60,2016/04/26 00:00,Wellcome Trust Sanger Institute,16509,132960827,SAMN04489828
GCA_001632525.1,Mus musculus (house mouse),Mus musculus,60,2016/05/09 00:00,Wellcome Trust Sanger Institute,16195,129642644,SAMN04489816
GCA_001624535.1,Mus musculus (house mouse),Mus musculus,60,2016/04/26 00:00,Wellcome Trust Sanger Institute,15797,127063089,SAMN04489825
GCA_000001545.3,Pongo abelii (Sumatran orangutan),Pongo abelii,6,2008/11/13 00:00,Orangutan Genome Sequencing Consortium,15652,747367,SAMN02981238
GCA_001632575.1,Mus musculus (house mouse),Mus musculus,60,2016/05/09 00:00,Wellcome Trust Sanger Institute,14540,133067396,SAMN04489818
GCA_001624185.1,Mus musculus (house mouse),Mus musculus,60,2016/04/26 00:00,Wellcome Trust Sanger Institute,14243,134541008,SAMN04489811
GCA_000230815.1,Macaca fascicularis (crab-eating macaque),Macaca fascicularis,50,2011/10/19 00:00,Beijing Genomics Institute,13209,1141162,SAMN00116341
GCA_001624505.1,Mus musculus (house mouse),Mus musculus,60,2016/04/26 00:00,Wellcome Trust Sanger Institute,13123,128213663,SAMN04489824
GCA_001624475.1,Mus musculus (house mouse),Mus musculus,60,2016/04/26 00:00,Wellcome Trust Sanger Institute,13074,144777665,SAMN04489823
GCA_000230795.1,Macaca mulatta (Rhesus monkey),Macaca mulatta,50,2011/10/19 00:00,Beijing Genomics Institute,12841,1660975,SAMN00113489
GCA_001632555.1,Mus musculus (house mouse),Mus musculus,60,2016/05/09 00:00,Wellcome Trust Sanger Institute,12707,139118349,SAMN04489821
GCA_001632615.1,Mus musculus (house mouse),Mus musculus,60,2016/05/09 00:00,Wellcome Trust Sanger Institute,12608,135164694,SAMN04489826
GCA_001624835.1,Mus musculus domesticus (western European house mouse),Mus musculus,60,2016/04/26 00:00,Wellcome Trust Sanger Institute,11777,133184209,SAMN04489831
GCA_001624445.1,Mus musculus castaneus (southeastern Asian house mouse),Mus musculus,60,2016/04/26 00:00,Wellcome Trust Sanger Institute,11642,133752109,SAMN04489822
GCA_000002275.2,Ornithorhynchus anatinus (platypus),Ornithorhynchus anatinus,0,2007/02/14 00:00,Washington University (WashU),11544,991605,SAMN02953646
GCA_001624675.1,Mus musculus (house mouse),Mus musculus,60,2016/04/26 00:00,Wellcome Trust Sanger Institute,9438,147352698,SAMN04489827
GCA_001624775.1,Mus musculus musculus (eastern European house mouse),Mus musculus,60,2016/04/26 00:00,Wellcome Trust Sanger Institute,5105,128387505,SAMN04489829
GCA_000003115.1,Felis catus (domestic cat),Felis catus,2.8,2009/03/16 00:00,NHGRI/Genome Technology Branch,4577,16304361,SAMN03000705
GCA_000222185.1,Macaca fascicularis (crab-eating macaque),Macaca fascicularis,0,2011/07/23 00:00,F. Hoffmann-La Roche Ltd,3658,155658674,SAMEA2272428
GCA_001883655.1,Lycaon pictus (African hunting dog),Lycaon pictus,5.8,2016/12/01 00:00,Smithsonian Institution,2695,64190785,SAMN04312209
GCA_004361675.1,Capra hircus (goat),Capra hircus,14,2019/03/22 00:00,Bangladesh Goat Genome Consortium (BGGC),819,102339471,SAMN10460883
GCA_012559485.1,Macaca fascicularis (crab-eating macaque),Macaca fascicularis,81,2020/04/08 00:00,Keio University / RIKEN,26269796,149875912,SAMD00204697
GCA_013373975.1,Callithrix jacchus (white-tufted-ear marmoset),Callithrix jacchus,43,2020/06/03 00:00,Keio University / RIKEN,24828868,132271759,SAMD00217773
GCF_000189315.1,Sarcophilus harrisii (Tasmanian devil),Sarcophilus harrisii,85,2011/02/17 00:00,Wellcome Trust Sanger Institute,20139,1847106,SAMN02953780
GCA_001292865.1,Sus scrofa (pig),Sus scrofa,20,2015/09/16 00:00,F. Hoffmann - La Roche AG,17259,153651326,SAMN03938573
GCA_000448345.1,Cricetulus griseus (Chinese hamster),Cricetulus griseus,70,2013/08/29 00:00,"CeBiTec, Bielefeld University",11899,1236516,SAMN02981520
GCA_009823495.1,Capra hircus (goat),Capra hircus,100,2019/12/31 00:00,Sher-e-Kashmir University of Agricultural Sciences and Technology,87277385,87277385,SAMN09789169
GCA_012070465.1,Bos indicus x Bos taurus (hybrid cattle),Bos indicus x Bos taurus,100,2020/04/06 00:00,PacBio,40480153,40480153,SAMN08473802
GCA_012070485.1,Bos indicus x Bos taurus (hybrid cattle),Bos indicus x Bos taurus,100,2020/04/06 00:00,PacBio,40480153,104836537,SAMN08473802
GCA_012070445.1,Bos indicus x Bos taurus (hybrid cattle),Bos indicus x Bos taurus,100,2020/04/06 00:00,PacBio,40473406,40473406,SAMN08473802
GCA_012070475.1,Bos indicus x Bos taurus (hybrid cattle),Bos indicus x Bos taurus,100,2020/04/06 00:00,PacBio,40473406,104899287,SAMN08473802
GCA_012069665.1,Bos indicus x Bos taurus (hybrid cattle),Bos indicus x Bos taurus,100,2020/04/06 00:00,PacBio,40459607,40459607,SAMN08473802
GCA_001420765.1,Homo sapiens (human),Homo sapiens,120,2015/11/02 00:00,NBACC,34007701,34007701,SAMN02743421
GCA_009859225.1,Mustela putorius furo (domestic ferret),Mustela putorius,18.57,2020/01/13 00:00,JCVI,33389539,33389539,SAMN13175630
GCA_010015535.1,Mustela putorius furo (domestic ferret),Mustela putorius,29.76,2020/01/30 00:00,JCVI,32367038,32367038,SAMN13175625
GCA_009859175.1,Mustela putorius furo (domestic ferret),Mustela putorius,21.82,2020/01/13 00:00,JCVI,32072651,32072651,SAMN13175627
GCA_009935935.1,Homo sapiens (human),Homo sapiens,70.6,2020/01/27 00:00,McDonnell Genome Institute at Washington University,30959455,30959455,SAMN12162847
